{
  "schema_version": "1.0",
  "index_id": "storage_run_video_20260724_001",
  "layout_profile": "opencrew-compatible-v1",
  "bundle_kind": "portable_evidence",
  "session_id": "video_LUMEN_LAUNCH",
  "task_id": "video_LUMEN_LAUNCH_t",
  "run_id": "run_video_20260724_001",
  "path_bases": [
    {
      "base": "workspace",
      "resolved_by": "storage_resolver",
      "example": "$OPENCREW_DATA_DIR/sessions/<session_ref>/workspace"
    },
    {
      "base": "run",
      "resolved_by": "run_record",
      "example": "tool_use_sessions/<run_id>"
    },
    {
      "base": "step",
      "resolved_by": "step_directory_map",
      "example": "S{index}_{tool}"
    },
    {
      "base": "step_attempt",
      "resolved_by": "attempt_record",
      "example": "Report/Attempts/A{no}_{attempt_id}"
    },
    {
      "base": "run_bundle",
      "resolved_by": "bundle_reader",
      "example": "."
    },
    {
      "base": "database",
      "resolved_by": "database_repository",
      "example": "session_events / task record / usage ledger"
    },
    {
      "base": "platform",
      "resolved_by": "deployment",
      "example": "configured process log sink outside Workspace"
    },
    {
      "base": "external",
      "resolved_by": "uri_scheme",
      "example": "s3://bucket/key?versionId=..."
    }
  ],
  "entries": [
    {
      "entry_id": "loc_705f8c46360c098b",
      "owner_type": "task",
      "owner_id": "video_LUMEN_LAUNCH_t",
      "purpose": "business_record",
      "authority": "database",
      "base": "database",
      "locator": "task:video_LUMEN_LAUNCH_t",
      "materialization": "external",
      "description": "Task is a database record that references the paired session Workspace; it has no duplicate file root.",
      "sha256": null,
      "size": null,
      "retention_class": "business_record"
    },
    {
      "entry_id": "loc_bee03b0419eabc43",
      "owner_type": "session",
      "owner_id": "video_LUMEN_LAUNCH",
      "purpose": "input",
      "authority": "file",
      "base": "workspace",
      "locator": "inbox/",
      "materialization": "layout_contract",
      "description": "Recommended immutable session input area; historical domain paths remain compatible.",
      "sha256": null,
      "size": null,
      "retention_class": "business_input"
    },
    {
      "entry_id": "loc_5bdd3bb1275e5f98",
      "owner_type": "run",
      "owner_id": "run_video_20260724_001",
      "purpose": "input_manifest",
      "authority": "file",
      "base": "run",
      "locator": "0_SessionContext/InputManifest.json",
      "materialization": "layout_contract",
      "description": "Live OpenCrew-compatible Run input snapshot; the portable demo keeps source fixtures beside the Process.",
      "sha256": null,
      "size": null,
      "retention_class": "run_evidence"
    },
    {
      "entry_id": "loc_e1125a0a60012768",
      "owner_type": "session",
      "owner_id": "video_LUMEN_LAUNCH",
      "purpose": "audit_event",
      "authority": "database",
      "base": "database",
      "locator": "session_events",
      "materialization": "external",
      "description": "Durable audit events live in the database; events.ndjson is a portable evidence projection.",
      "sha256": null,
      "size": null,
      "retention_class": "audit"
    },
    {
      "entry_id": "loc_39e71d38667d9266",
      "owner_type": "run",
      "owner_id": "run_video_20260724_001",
      "purpose": "state_snapshot",
      "authority": "database",
      "base": "database",
      "locator": "workflow_run:run_video_20260724_001",
      "materialization": "external",
      "description": "Target query authority for Run/Step state; run.json is the portable demo snapshot, not evidence that this target repository exists in current OpenCrew.",
      "sha256": null,
      "size": null,
      "retention_class": "run_state"
    },
    {
      "entry_id": "loc_7a2f22a90c911f3b",
      "owner_type": "run",
      "owner_id": "run_video_20260724_001",
      "purpose": "usage",
      "authority": "database",
      "base": "database",
      "locator": "usage_ledger:run_video_20260724_001",
      "materialization": "external",
      "description": "Target Usage/Cost ledger authority; current OpenCrew maps only part of this contract through local_usage_log.",
      "sha256": null,
      "size": null,
      "retention_class": "financial_audit"
    },
    {
      "entry_id": "loc_ca51e8bb26cbc282",
      "owner_type": "service",
      "owner_id": "flowspec-runtime",
      "purpose": "service_log",
      "authority": "log_service",
      "base": "platform",
      "locator": "configured-service-log-sink",
      "materialization": "external",
      "description": "API/worker/scheduler process logs are deployment-owned and must stay outside the session Workspace.",
      "sha256": null,
      "size": null,
      "retention_class": "operations"
    },
    {
      "entry_id": "loc_5420dc086343d532",
      "owner_type": "run",
      "owner_id": "run_video_20260724_001",
      "purpose": "state_snapshot",
      "authority": "file",
      "base": "run_bundle",
      "locator": "run.json",
      "materialization": "materialized",
      "description": "Portable demo evidence file; live deployments may use database or Workspace bindings.",
      "sha256": "sha256:00e073678ef40d60d5dbfa5a0ea3efafc91309032a6345942a34ccfcd12c50ee",
      "size": 184133,
      "retention_class": "run_evidence"
    },
    {
      "entry_id": "loc_9808959b9a9756ab",
      "owner_type": "run",
      "owner_id": "run_video_20260724_001",
      "purpose": "audit_event",
      "authority": "file",
      "base": "run_bundle",
      "locator": "events.ndjson",
      "materialization": "materialized",
      "description": "Portable demo evidence file; live deployments may use database or Workspace bindings.",
      "sha256": "sha256:852ff368ea7a19eb7833a858ee113a711554732034f7bbe3aa43a5b47ae2d94e",
      "size": 82351,
      "retention_class": "run_evidence"
    },
    {
      "entry_id": "loc_827a07f97dee65de",
      "owner_type": "run",
      "owner_id": "run_video_20260724_001",
      "purpose": "usage",
      "authority": "file",
      "base": "run_bundle",
      "locator": "usage.json",
      "materialization": "materialized",
      "description": "Portable demo evidence file; live deployments may use database or Workspace bindings.",
      "sha256": "sha256:e3d44e5c1b20c6a674747b09145f1e458fd143f3b0ec11298bf2b85d984e7ef7",
      "size": 27071,
      "retention_class": "run_evidence"
    },
    {
      "entry_id": "loc_3dc14ce0e767c215",
      "owner_type": "run",
      "owner_id": "run_video_20260724_001",
      "purpose": "budget",
      "authority": "file",
      "base": "run_bundle",
      "locator": "budget-ledger.json",
      "materialization": "materialized",
      "description": "Portable demo evidence file; live deployments may use database or Workspace bindings.",
      "sha256": "sha256:124bb2417d091107b0c73399c7958335adfb35492580e5e18647f2f3e3bfbb9b",
      "size": 14739,
      "retention_class": "run_evidence"
    },
    {
      "entry_id": "loc_022a7dfea9cd54da",
      "owner_type": "run",
      "owner_id": "run_video_20260724_001",
      "purpose": "definition",
      "authority": "file",
      "base": "run_bundle",
      "locator": "definition/process.snapshot.json",
      "materialization": "materialized",
      "description": "Portable demo evidence file; live deployments may use database or Workspace bindings.",
      "sha256": "sha256:f6356170a72d275bdb2f4331491a7c975e3f85377cebc05073d7ebfcbc0befe7",
      "size": 23997,
      "retention_class": "run_evidence"
    },
    {
      "entry_id": "loc_3f025f23945d6c41",
      "owner_type": "run",
      "owner_id": "run_video_20260724_001",
      "purpose": "definition",
      "authority": "file",
      "base": "run_bundle",
      "locator": "definition/tool-registry.snapshot.json",
      "materialization": "materialized",
      "description": "Portable demo evidence file; live deployments may use database or Workspace bindings.",
      "sha256": "sha256:f077494eb480d20ab2222ef0ae7212f6df90754978c684af0ae6356b5af60212",
      "size": 9239,
      "retention_class": "run_evidence"
    },
    {
      "entry_id": "loc_9acce26d80e4a8ee",
      "owner_type": "run",
      "owner_id": "run_video_20260724_001",
      "purpose": "definition",
      "authority": "file",
      "base": "run_bundle",
      "locator": "definition/profiles/creative-agent.json",
      "materialization": "materialized",
      "description": "Portable demo evidence file; live deployments may use database or Workspace bindings.",
      "sha256": "sha256:13810b4191cc965c9f0057d31cf27a4d9ca53dcacab643fdfba49fccbe397197",
      "size": 1870,
      "retention_class": "run_evidence"
    },
    {
      "entry_id": "loc_e6ba05152b225213",
      "owner_type": "run",
      "owner_id": "run_video_20260724_001",
      "purpose": "definition",
      "authority": "file",
      "base": "run_bundle",
      "locator": "definition/profiles/image-model.json",
      "materialization": "materialized",
      "description": "Portable demo evidence file; live deployments may use database or Workspace bindings.",
      "sha256": "sha256:c22996e91397b1174d2b31ad31bb882a50efa78e677601e19d8af3cedc0b7a69",
      "size": 1361,
      "retention_class": "run_evidence"
    },
    {
      "entry_id": "loc_db5aa8642fa961c3",
      "owner_type": "run",
      "owner_id": "run_video_20260724_001",
      "purpose": "definition",
      "authority": "file",
      "base": "run_bundle",
      "locator": "definition/profiles/planning-model.json",
      "materialization": "materialized",
      "description": "Portable demo evidence file; live deployments may use database or Workspace bindings.",
      "sha256": "sha256:c26e2c8111985374f035ce95dcae3dfb0d285446d2946db48e3c76b9550902b5",
      "size": 1345,
      "retention_class": "run_evidence"
    },
    {